comentario,Agresividad,Ofensa,Ideología,Constructividad,Empatía,Diálogo,Total,Catg
"Y para que vas entonces? No hay necesidad,, además no serás presidente, ya quedaron al descubierto tú y tu wachiman.",50.0,35.0,20.0,5.0,5.0,5.0,60.5,0.0
QUE NI EL PAR DE CHIFLADOS DEL PAZ Y LARI CONOCEN........,40.0,50.0,40.0,20.0,5.0,5.0,61.0,0.0
TUTO PRESIDENTE 💯💯💪💯💪💯,10.0,5.0,90.0,5.0,5.0,10.0,54.5,0.0
Osea le esta yendo a mostrar al imperialismo su propuesta para que??,45.0,50.0,80.0,5.0,5.0,5.0,71.25,-1.0
Ni los Bolivianos conocemos su plan de gobierno ... y va a mostrarlo a los States,45.0,50.0,80.0,5.0,5.0,5.0,71.25,-1.0
Se van a reír de él 😅🤣,20.0,30.0,20.0,5.0,5.0,5.0,52.0,0.0
Coño hipocrita,40.0,50.0,20.0,10.0,5.0,10.0,59.5,0.0
"No te hagas, irás al Chapare!",80.0,80.0,10.0,5.0,5.0,10.0,75.0,-1.0
Y ahora es un vendepatrias? O alguien solo es vendepatrias cuando les conviene?,70.0,70.0,60.0,5.0,5.0,5.0,78.5,-1.0
este se va a hacer fumar Criticaban a tuto y eso que tuto que es preparado para temas de negocios y este a va ir y conociendo … Ver más,50.0,50.0,60.0,5.0,5.0,5.0,69.5,-1.0
No vaya a EEUU a pedir dinero a los Bolivianos igual que su paisano,60.0,80.0,40.0,5.0,5.0,5.0,75.0,-1.0
Jajajaja par de inútiles Rodrigo y el lari no saben cómo hacer un plan para poder salvar a bolivia de la crisis que nos dejan … Ver más,40.0,60.0,30.0,5.0,5.0,5.0,64.5,0.0
EL DECIA que a los gringos se le debe: Ahora el va para halla...(ESPERO LO VOTEN DE EE.UU.) … Ver más,40.0,50.0,60.0,5.0,5.0,5.0,67.0,-1.0
"VA IR A ESTADO UNIDOS A PRESENTAR SU PLAN DE ""ROBAR AUTOS"" EN COLCHANE Y ARICA DIRA QUE EL PROCESO DE CAMBIO VIENE EN CAMINO🚗🚙🛻🚚 🤣🤣🤣🤣",40.0,50.0,60.0,5.0,5.0,5.0,67.0,-1.0
Capitalismo saqueo de RIQUEZAS..RIQUEZAS en pocas manos..real se baja los pantalones frente al Yanqui,80.0,80.0,40.0,5.0,5.0,10.0,79.5,-1.0
Llevará su plan hecho con chat GPT?🤡,30.0,50.0,50.0,5.0,5.0,5.0,63.0,0.0
Ellos están ya bien enterados de todo o crees que en USA no ay redes sociales? por educación te saludarán y luego te dirán gra… Ver más,40.0,50.0,50.0,5.0,5.0,5.0,65.5,0.0
No que no quería prestarse? 😂😂😂,20.0,40.0,50.0,5.0,5.0,5.0,58.5,0.0
Da flojera ver a ese loco ya,40.0,50.0,20.0,5.0,5.0,10.0,60.5,0.0
No pudo manejar una simple Alcaldía en Tarija y quiere ser presidente?? Aver a pocas palabras buen entendedor no??,60.0,70.0,50.0,5.0,5.0,5.0,74.5,-1.0
Otro payaso de Rodrigo Paz 🤡🤡🤡,60.0,70.0,50.0,5.0,5.0,5.0,74.5,-1.0
Y los masimulas no van a decir nada? JAJAJA no que rajan tanto contra su enemigo imaginario de EEUU?,60.0,70.0,50.0,5.0,5.0,5.0,74.5,-1.0
"Será a Disneylandia al País de las Maravillas 🎉🎉, pura, puraaa 💩💩🤮",60.0,70.0,50.0,5.0,5.0,5.0,74.5,-1.0
ES CON TUTO PRESIDENTE!!!,10.0,5.0,90.0,5.0,5.0,10.0,54.5,0.0
Debe pensar que por su cara le ayudaran … Ver más,90.0,85.0,5.0,10.0,5.0,10.0,76.75,-1.0
Esta dupla improvisados un desastre,85.0,75.0,20.0,0.0,0.0,0.0,79.25,-1.0
Jjjj no que no???,20.0,10.0,0.0,0.0,0.0,0.0,47.0,0.0
QUE RARO SI EL RECONOCIO QUE NI LEYO SU PLAN DE GOBIERNO Y QUE OTROS HICIERON ESE PLAN?,40.0,45.0,50.0,0.0,0.0,0.0,66.5,-1.0
Que le pida el proyecto a los hijos del Arce si a ellos les fue bien porque no a este señor que no sabe absolutamente nada sob… Ver más,90.0,85.0,5.0,0.0,0.0,0.0,80.25,-1.0
Dios no ya ambos no sirven para presidente si nos van a entregar a estados unidos...,85.0,90.0,40.0,0.0,0.0,0.0,85.25,-1.0
"Rodrigo Paz solo puede engañar a la clase baja que su lista de problemas es un plan de gobierno, cuando en realidad solo plant… Ver más",90.0,85.0,5.0,0.0,10.0,0.0,79.25,-1.0
POBRE TIPO !! TODO ES DEMAGOGIA! LO QUE SE LE VIENE A SU CABEZA OFRECE!!!,90.0,85.0,5.0,0.0,10.0,0.0,79.25,-1.0
Deja de JODER a Bolivia y si viajas ponle BOZAL a tu jefe o vice 🤭🤭,90.0,85.0,5.0,0.0,10.0,0.0,79.25,-1.0
Lara le habrá dado permiso?,90.0,85.0,5.0,0.0,10.0,0.0,79.25,-1.0
"PATADAS DE OHOGADO, PURO HUMO, PURO PROSELITISMO. DEL DICHO, AL HECHO, DICTA MUCHO TRECHO. EL ARBOL POR SUS FRUTOS S… Ver más",90.0,85.0,5.0,0.0,10.0,0.0,79.25,-1.0
El socialista!!! Ggggg,90.0,85.0,5.0,0.0,0.0,0.0,80.25,-1.0
Deje de mentir uno q usted ni ha hecho público las auditorías de todo!! y x lo tanto el país tiene q enterarse q están dejand… Ver más,90.0,85.0,5.0,0.0,0.0,0.0,80.25,-1.0
Jajaja y cuando fue TUTO lo insultaron le dijeron q esta yendo a vender Bolivia q fue a bajarse los pantalones allá y ahora el… Ver más,90.0,85.0,5.0,0.0,0.0,0.0,80.25,-1.0
Estupidez como todo de un zurdo o capaz,,,,,,,,
"Este quiere vender a Bolivia,",90.0,85.0,5.0,0.0,10.0,0.0,79.25,-1.0
"LA PREGUNTA ES SABE HABLAR INGLES ESTE ZURDO SOCIALISTA DE RODRIGO??? RESPUESTA NOOO,SEGURO SE LLEVARA DE TRADUCTOR A LARI… Ver más",90.0,85.0,5.0,0.0,0.0,0.0,80.25,-1.0
Tu programa es una lágrima,90.0,85.0,5.0,0.0,10.0,0.0,79.25,-1.0
Igual estas limosneando,90.0,85.0,5.0,0.0,10.0,0.0,79.25,-1.0
Está yendo a pasear,90.0,85.0,5.0,0.0,10.0,0.0,79.25,-1.0
Porque no presenta en Tarija???,90.0,85.0,5.0,0.0,10.0,0.0,79.25,-1.0
NO LE VAN A DAR NI EL SALUDO POR QUE SABEN QUE ES SOCIALISTA,90.0,85.0,50.0,0.0,0.0,0.0,87.0,-1.0
Esa es su forma de arrodillarse y rogarse que lo ayuden. Payaso 🤡,,,,,,,,
Ya se saco los pantalones el lacayo ante su patrón es un pobre cobarde servil al imperialismo es OMISO no puede ser presidente,90.0,85.0,50.0,0.0,0.0,0.0,87.0,-1.0
🤣😂🤣😂🤣😂,90.0,85.0,50.0,0.0,0.0,0.0,87.0,-1.0
Su plan de legalizar autos robados.,,,,,,,,
Este imperialista vende patria.. 😂😂😂😂,90.0,85.0,50.0,0.0,0.0,0.0,87.0,-1.0
Y por qué no lo hace aquí??? Respuesta= No hay nada = UDP 2.0,90.0,85.0,50.0,0.0,0.0,0.0,87.0,-1.0
RODRIGO PAZ PRESIDENTE… Ver más,,,,,,,,
Hasta ahora no dio a conocer algo bien estructurado🤦🏻‍♀️,,,,,,,,
